Year/Date,Event Name,Description,Category,Key Figures/Organizations,Location,Impact/Significance,References/Sources,Technological Type
1950,Turing Test,"Alan Turing proposed the imitation game to assess machine intelligence.",Theoretical Foundations,Alan Turing,UK,"Introduced a foundational concept for evaluating machine intelligence.",https://en.wikipedia.org/wiki/Turing_test,Theoretical AI
1956,Dartmouth Conference,"The term ""Artificial Intelligence"" was coined at this workshop.",Major Breakthroughs,"John McCarthy; Marvin Minsky; Claude Shannon",USA,"Marked the birth of AI as an academic field.",https://en.wikipedia.org/wiki/Dartmouth_workshop,General AI
1958,Perceptron,"Frank Rosenblatt developed the first neural network model – the perceptron.",Neural Networks,Frank Rosenblatt,USA,"Pioneered early neural network research.",https://en.wikipedia.org/wiki/Perceptron,Neural Networks
1961,Unimate Robot,"The first industrial robot, Unimate, was deployed in a General Motors plant.",Applications,Unimation,USA,"Laid the groundwork for robotics in manufacturing.",https://en.wikipedia.org/wiki/Unimate,Robotics
1966,ELIZA,"Joseph Weizenbaum created ELIZA, an early natural language processing program that simulated conversation.",NLP,Joseph Weizenbaum,USA,"Demonstrated early potential for human-computer dialogue.",https://en.wikipedia.org/wiki/ELIZA,Natural Language Processing
1969,Shakey the Robot,"Shakey, developed at SRI International, became the first mobile robot to reason about its actions.",Robotics,SRI International,USA,"Integrated AI planning with robotics.",https://en.wikipedia.org/wiki/Shakey_the_Robot,Robotics; Planning
1970,MYCIN,"An expert system developed for diagnosing blood infections.",Expert Systems,Edward Shortliffe,USA,"Laid the foundation for rule-based expert systems in medicine.",https://en.wikipedia.org/wiki/MYCIN,Expert Systems
1973,Lighthill Report,"The Lighthill report criticized AI research progress, leading to reduced funding.",AI Winters,James Lighthill,UK,"Contributed to the first AI winter.",https://en.wikipedia.org/wiki/Lighthill_report,General AI
1980,Rise of Expert Systems,"Commercial success of expert systems in business and industry became evident.",Expert Systems,Various,USA/Europe,"Demonstrated commercial viability of rule-based AI.",https://en.wikipedia.org/wiki/Expert_system,Expert Systems
1986,Backpropagation Breakthrough,"Revival of neural network training through the backpropagation algorithm.",Neural Networks,"Geoffrey Hinton; David Rumelhart; Ronald Williams",USA,"Revolutionized the training of multi-layer neural networks.",https://en.wikipedia.org/wiki/Backpropagation,Neural Networks
1987,Rise of Fuzzy Logic,"Fuzzy logic began to be applied to control systems and decision-making.",Applications,Lotfi Zadeh,Global,"Enhanced handling of imprecise information in AI systems.",https://en.wikipedia.org/wiki/Fuzzy_logic,Control Systems
1988,Introduction of Genetic Algorithms,"Genetic algorithms were introduced for solving optimization problems.",Machine Learning,John Holland,USA,"Inspired a family of evolutionary computation techniques.",https://en.wikipedia.org/wiki/Genetic_algorithm,Machine Learning
1990,Early Autonomous Vehicles Research,"Initial experiments with autonomous vehicles began to take shape.",Robotics,Various,USA,"Set the stage for modern self-driving car technology.",https://en.wikipedia.org/wiki/Autonomous_car,Robotics
1991,TD-Gammon,"Gerald Tesauro developed a backgammon-playing neural network, TD-Gammon.",Neural Networks,Gerald Tesauro,USA,"Demonstrated the power of neural networks in game playing.",https://en.wikipedia.org/wiki/TD-Gammon,Neural Networks
1997,Deep Blue vs Kasparov,"IBM's Deep Blue defeated world chess champion Garry Kasparov.",Major Breakthroughs,IBM,USA,"Showcased the potential of AI in complex strategic tasks.",https://en.wikipedia.org/wiki/Deep_Blue,AI Models
1998,Support Vector Machines,"The development and popularization of support vector machines for classification.",Machine Learning,Vladimir Vapnik,Global,"Revolutionized pattern recognition techniques.",https://en.wikipedia.org/wiki/Support-vector_machine,Machine Learning
2000,Emergence of Data Mining,"Advances in data mining techniques boosted AI’s ability to extract patterns.",Applications,Various,Global,"Enhanced the extraction of actionable insights from large data sets.",https://en.wikipedia.org/wiki/Data_mining,Machine Learning
2001,Roomba Introduction,"iRobot released the Roomba, bringing AI-driven robotics to households.",Robotics,iRobot,USA,"Popularized consumer robotics.",https://en.wikipedia.org/wiki/Roomba,Robotics
2002,Advances in Speech Recognition,"Significant improvements in speech recognition algorithms were achieved.",NLP,Various,Global,"Enhanced AI applications in voice interfaces.",https://en.wikipedia.org/wiki/Speech_recognition,Natural Language Processing
2003,Open Source AI Tools,"Early open-source AI libraries were introduced, democratizing AI development.",Applications,Various,Global,"Increased accessibility to AI research and development.",https://en.wikipedia.org/wiki/Open-source_software,Software
2004,DARPA Grand Challenge,"Autonomous vehicles competed in the DARPA Grand Challenge, spurring innovation.",Robotics,DARPA,USA,"Accelerated self-driving vehicle technology.",https://en.wikipedia.org/wiki/DARPA_Grand_Challenge,Robotics
2005,Robotics in Manufacturing,"AI-driven robotics became more widely integrated in industrial manufacturing.",Applications,Various,Global,"Boosted efficiency and productivity in manufacturing.",https://en.wikipedia.org/wiki/Industrial_robot,Robotics
2006,Deep Learning Renaissance,"Renewed interest in deep neural networks was sparked by new training techniques.",Deep Learning,Geoffrey Hinton,USA,"Launched the modern deep learning era.",https://en.wikipedia.org/wiki/Deep_learning,Neural Networks
2007,Google Street View,"Google used AI to process and organize vast amounts of street-level imagery.",Applications,Google,USA,"Advanced mapping and image recognition technologies.",https://en.wikipedia.org/wiki/Google_Street_View,Computer Vision
2008,ImageNet Initiation,"The launch of the ImageNet dataset provided a massive resource for image recognition.",Applications,Fei-Fei Li,USA,"Fueled significant advances in computer vision.",https://en.wikipedia.org/wiki/ImageNet,Computer Vision
2009,Prototype Self-Driving Cars,"Research prototypes of self-driving vehicles began demonstrating autonomous capabilities.",Robotics,Various,USA,"Paved the way for modern autonomous vehicles.",https://en.wikipedia.org/wiki/Self-driving_car,Robotics
2010,IBM Watson Research,"Development of Watson, a system designed to answer complex questions.",AI Models,IBM,USA,"Pioneered cognitive computing in AI.",https://en.wikipedia.org/wiki/IBM_Watson,NLP
2011,Watson Wins Jeopardy!,"IBM's Watson defeated human champions on the game show Jeopardy!.",Major Breakthroughs,IBM,USA,"Showcased advanced natural language processing and reasoning.",https://en.wikipedia.org/wiki/IBM_Watson,NLP
2012,AlexNet Wins ImageNet,"The deep convolutional neural network AlexNet revolutionized image recognition.",Deep Learning,"Alex Krizhevsky; Geoffrey Hinton",USA/Canada,"Sparked a surge of deep learning research.",https://en.wikipedia.org/wiki/AlexNet,Neural Networks; Computer Vision
2013,DeepMind Founded,"DeepMind was established to push the boundaries of AI research.",Major Breakthroughs,"Demis Hassabis; Shane Legg; Mustafa Suleyman",UK,"Became a leader in advanced AI research.",https://en.wikipedia.org/wiki/DeepMind,General AI
2014,GANs Invented,"Ian Goodfellow introduced Generative Adversarial Networks for realistic data synthesis.",Machine Learning,Ian Goodfellow,USA,"Opened new avenues in image and video generation.",https://en.wikipedia.org/wiki/Generative_adversarial_network,Neural Networks
2014,Amazon Alexa Launch,"Amazon introduced Alexa, a voice-activated AI assistant.",Applications,Amazon,USA,"Accelerated AI adoption in consumer electronics.",https://en.wikipedia.org/wiki/Amazon_Alexa,NLP; IoT
2015,AlphaGo Development Begins,"DeepMind began work on AlphaGo, an AI designed to play the game of Go.",AI Models,DeepMind,UK,"Set the stage for breakthroughs in strategic game AI.",https://en.wikipedia.org/wiki/AlphaGo,Neural Networks
2016,AlphaGo Defeats Lee Sedol,"AlphaGo defeated world champion Lee Sedol in the board game Go.",Major Breakthroughs,DeepMind,South Korea,"Demonstrated the power of deep reinforcement learning.",https://en.wikipedia.org/wiki/AlphaGo,Neural Networks
2017,Advances in Reinforcement Learning,"Breakthroughs in reinforcement learning algorithms led to improved decision-making.",Machine Learning,Various,Global,"Enhanced the performance of autonomous agents.",https://en.wikipedia.org/wiki/Reinforcement_learning,Reinforcement Learning
2017,Commercial Self-Driving Trials,"Companies began trial runs of self-driving cars in real-world conditions.",Robotics,Various,Global,"Accelerated the push toward autonomous transportation.",https://en.wikipedia.org/wiki/Self-driving_car,Robotics
2018,BERT Model Released,"Google introduced BERT, a groundbreaking language understanding model.",NLP,Google,USA,"Improved context understanding in natural language processing.",https://en.wikipedia.org/wiki/BERT_(language_model),Neural Networks; NLP
2018,AI in Healthcare Expansion,"AI technologies were increasingly adopted in medical diagnostics and research.",Applications,Various,Global,"Enhanced accuracy and efficiency in healthcare solutions.",https://en.wikipedia.org/wiki/Artificial_intelligence_in_healthcare,Machine Learning
2019,OpenAI Five in Dota 2,"OpenAI Five demonstrated competitive-level play in the complex game Dota 2.",AI Models,OpenAI,USA,"Showed AI's capability in multi-agent strategic games.",https://en.wikipedia.org/wiki/OpenAI_Five,Reinforcement Learning
2019,GPT-2 Release,"OpenAI released GPT-2, a large-scale language model that advanced text generation.",NLP,OpenAI,USA,"Pushed the boundaries of natural language generation.",https://en.wikipedia.org/wiki/GPT-2,Neural Networks; NLP
2020,COVID-19 AI Response,"AI tools were deployed extensively in response to the COVID-19 pandemic.",Applications,Various,Global,"Accelerated research and data analysis during a global crisis.",https://en.wikipedia.org/wiki/Coronavirus_disease_2019,Machine Learning
2020,GPT-3 Released,"OpenAI launched GPT-3, significantly advancing language processing capabilities.",NLP,OpenAI,USA,"Marked a leap forward in text generation and understanding.",https://en.wikipedia.org/wiki/GPT-3,Neural Networks; NLP
2020,AI in Climate Modeling,"Advanced AI models contributed to improved climate change prediction models.",Applications,Various,Global,"Enhanced predictive power for environmental research.",https://en.wikipedia.org/wiki/Climate_change,Machine Learning
2021,AlphaFold Breakthrough,"DeepMind's AlphaFold accurately predicted protein folding, revolutionizing biology.",Applications,DeepMind,UK,"Transformed biological research and drug discovery.",https://en.wikipedia.org/wiki/AlphaFold,Neural Networks; Bioinformatics
2021,AI-Generated Art Surge,"AI-created art gained significant public and market attention.",Applications,Various,Global,"Challenged traditional notions of creativity and art.",https://en.wikipedia.org/wiki/AI_art,Neural Networks
2021,Autonomous Delivery Robots,"Delivery robots using AI began operating in urban environments.",Robotics,Various,Global,"Improved last-mile delivery logistics.",https://en.wikipedia.org/wiki/Autonomous_delivery_robot,Robotics
2022,AI in Finance,"AI-driven analysis and trading algorithms became mainstream in finance.",Applications,Various,Global,"Enhanced decision-making and operational efficiency in finance.",https://en.wikipedia.org/wiki/Algorithmic_trading,Machine Learning
2022,Multimodal AI Advances,"Models began integrating text, image, and audio data for richer applications.",AI Models,Various,Global,"Expanded the scope and capability of AI systems.",https://en.wikipedia.org/wiki/Multimodal_learning,Neural Networks
2022,Development of AI Ethics Frameworks,"Comprehensive ethical guidelines for AI development were formulated.",Ethics & Regulation,Various,Global,"Set new standards for responsible AI innovation.",https://en.wikipedia.org/wiki/Ethics_of_artificial_intelligence,General AI
2022,AI in Agriculture,"Adoption of AI in agriculture improved crop monitoring and yield predictions.",Applications,Various,Global,"Boosted agricultural efficiency and sustainability.",https://en.wikipedia.org/wiki/Precision_agriculture,Machine Learning
2023,GPT-4 Released,"OpenAI released GPT-4, a multimodal model advancing language and reasoning.",AI Models,OpenAI,USA,"Furthered the state-of-the-art in language processing.",https://en.wikipedia.org/wiki/GPT-4,Neural Networks; NLP
2023,AI in Drug Discovery,"AI techniques accelerated the drug discovery process across the pharmaceutical industry.",Applications,Various,Global,"Shortened development timelines and reduced costs.",https://en.wikipedia.org/wiki/Drug_discovery,Machine Learning
2023,AI for Climate Change Mitigation,"AI was applied to optimize energy consumption and reduce carbon emissions.",Applications,Various,Global,"Contributed to environmental sustainability efforts.",https://en.wikipedia.org/wiki/Climate_change,Machine Learning
2024,Global AI Regulation Developments,"Governments worldwide advanced policies to regulate AI technologies.",Ethics & Regulation,Various,Global,"Shaping the future framework for AI governance.",https://en.wikipedia.org/wiki/Ethics_of_artificial_intelligence,General AI
2024,AI and Quantum Computing Collaboration,"Initial collaborations between AI and quantum computing researchers began.",Major Breakthroughs,Various,Global,"Explored new frontiers in computational speed and AI efficiency.",https://example.com/ai-quantum_collab,Quantum AI
2024,Edge AI Expansion,"Deployment of AI on edge devices increased, enabling real-time processing.",Applications,Various,Global,"Enhanced AI performance in decentralized environments.",https://example.com/edge-ai,Embedded AI
2024,AI for Social Good Projects,"AI initiatives aimed at solving global social challenges gained momentum.",Applications,Various,Global,"Promoted the use of AI in addressing societal issues.",https://example.com/ai-social_good,General AI
2024,AI in Cybersecurity,"Advanced AI systems began to transform threat detection and response.",Applications,Various,Global,"Improved cybersecurity defenses through automation.",https://example.com/ai-cybersecurity,Machine Learning
2024,Robotics and AI Convergence,"Tighter integration between robotics and AI led to smarter automation.",Robotics,Various,Global,"Pushed forward the next generation of autonomous machines.",https://example.com/ai-robotics,Robotics
2024,AI-Driven Personalization,"AI-enhanced personalization in digital services reached new heights.",Applications,Various,Global,"Transformed user experiences across industries.",https://example.com/ai-personalization,Machine Learning
2024,Next-Gen AI Research Centers,"New AI research centers were established worldwide, accelerating innovation.",Major Breakthroughs,Various,Global,"Expanded the global AI research infrastructure.",https://example.com/ai-research_centers,General AI
2024,AI in Renewable Energy,"AI optimized renewable energy production and grid management.",Applications,Various,Global,"Boosted the efficiency of renewable energy systems.",https://example.com/ai-renewable_energy,Machine Learning
2024,Augmented Reality and AI Merge,"Integration of AR with AI technologies began transforming user interfaces.",Applications,Various,Global,"Enhanced interactive experiences with smart technologies.",https://example.com/ar-ai_merge,Computer Vision
2024,AI in Education,"AI-powered educational tools transformed learning methodologies.",Applications,Various,Global,"Enabled personalized and adaptive learning experiences.",https://example.com/ai-education,Machine Learning
2024,AI-Powered Climate Forecasting,"Enhanced climate models using AI improved weather prediction accuracy.",Applications,Various,Global,"Supported better planning for climate resilience.",https://example.com/ai-climate_forecasting,Machine Learning
2024,Global AI Summit 2024,"A major international summit showcased the latest in AI research and applications.",Major Breakthroughs,Various,Global,"Brought together experts to shape the future of AI.",https://example.com/global-ai_summit,General AI
2024,AI in Logistics Optimization,"AI systems were deployed to streamline global logistics and supply chains.",Applications,Various,Global,"Improved efficiency and reduced costs in logistics.",https://example.com/ai-logistics,Machine Learning
2024,AI-Enhanced Virtual Assistants,"Next-generation virtual assistants integrated deeper AI capabilities.",Applications,Various,Global,"Set new standards for human-computer interaction.",https://example.com/ai_virtual_assistants,NLP
2024,AI in Disaster Response,"AI tools played a critical role in coordinating disaster response efforts.",Applications,Various,Global,"Improved emergency management and resource allocation.",https://example.com/ai-disaster_response,Machine Learning
2024,AI and Ethics Research Consortium,"An international consortium was formed to study AI ethics and safety.",Ethics & Regulation,Various,Global,"Advanced research into the responsible use of AI.",https://example.com/ai-ethics_consortium,General AI
2024,AI-Driven Content Creation,"Automated systems for content creation and media production reached maturity.",Applications,Various,Global,"Transformed the creative industries through automation.",https://example.com/ai-content_creation,Neural Networks
2024,AI in Retail Innovations,"AI applications in retail personalized shopping and inventory management.",Applications,Various,Global,"Enhanced customer experiences and operational efficiency.",https://example.com/ai-retail,Machine Learning
2024,Neuro-Symbolic AI Advances,"Integration of neural networks with symbolic reasoning achieved new milestones.",AI Models,Various,Global,"Bridged the gap between learning and reasoning in AI.",https://example.com/neuro-symbolic_ai,Neural Networks
2024,AI in Autonomous Farming,"Robotics and AI combined to advance precision farming techniques.",Applications,Various,Global,"Increased agricultural productivity and sustainability.",https://example.com/ai-autonomous_farming,Machine Learning
2024,AI for Wildlife Conservation,"AI tools were used to monitor and protect endangered species.",Applications,Various,Global,"Enhanced conservation efforts through data-driven insights.",https://example.com/ai-wildlife_conservation,Machine Learning
2024,Hybrid AI Architectures,"New AI architectures combined classical and modern methods for improved performance.",AI Models,Various,Global,"Expanded the design space of AI systems.",https://example.com/hybrid_ai_architectures,General AI
2024,AI in Space Exploration,"AI assisted in planning and executing space missions.",Applications,Various,Global,"Boosted the capabilities of space exploration initiatives.",https://example.com/ai-space_exploration,Machine Learning
2024,Personalized AI Health Advisors,"AI-powered health advisors began providing personalized medical guidance.",Applications,Various,Global,"Transformed preventive healthcare through personalization.",https://example.com/ai_health_advisors,Machine Learning
2024,AI-Enhanced Manufacturing,"Smart factories integrated AI for end-to-end process optimization.",Applications,Various,Global,"Revolutionized manufacturing with predictive maintenance and automation.",https://example.com/ai_manufacturing,Robotics
2024,AI in Sports Analytics,"Advanced AI techniques reshaped performance analytics in sports.",Applications,Various,Global,"Improved athlete performance and strategic planning.",https://example.com/ai_sports_analytics,Machine Learning
2024,AI for Urban Planning,"City planning began leveraging AI to optimize infrastructure development.",Applications,Various,Global,"Enhanced urban management and resource distribution.",https://example.com/ai_urban_planning,Machine Learning
2024,AI-Driven Supply Chain Security,"AI systems were deployed to secure global supply chains against disruptions.",Applications,Various,Global,"Strengthened the resilience of logistics networks.",https://example.com/ai_supply_chain_security,Machine Learning
2024,Advanced AI Simulations,"Next-generation simulations using AI provided unprecedented insights into complex systems.",Applications,Various,Global,"Expanded the potential for AI-driven research across domains.",https://example.com/ai_simulations,General AI
2024,AI in Personalized Marketing,"AI refined personalized marketing strategies using consumer data analytics.",Applications,Various,Global,"Revolutionized targeted marketing and customer engagement.",https://example.com/ai_personalized_marketing,Machine Learning
2024,AI-Enhanced Financial Fraud Detection,"Innovative AI systems significantly improved fraud detection in finance.",Applications,Various,Global,"Increased the security and trustworthiness of financial transactions.",https://example.com/ai_fraud_detection,Machine Learning
2024,AI in Real-Time Translation,"Real-time language translation powered by AI reached new accuracy levels.",NLP,Various,Global,"Facilitated global communication through improved language services.",https://example.com/ai_real_time_translation,Neural Networks; NLP
2024,AI-Powered Environmental Monitoring,"Distributed AI sensors improved real-time environmental monitoring.",Applications,Various,Global,"Supported proactive measures for environmental protection.",https://example.com/ai_environment_monitoring,Machine Learning
2024,AI and Blockchain Integration,"Initial integrations of AI with blockchain technology began to emerge.",Applications,Various,Global,"Explored secure and transparent AI data handling.",https://example.com/ai_blockchain,General AI
